{
  "schema_version": "1.0",
  "receipt_type": "COMPLETENESS_RECEIPT",
  "ring": "R7-K",
  "native_version": "vTemporal.41.0",
  "implementation_identity": "v41 Complete",
  "stability_baseline": "ae8dd9e22a34589f546f64ed452c0eee976cf299",
  "documentation": {
    "README": "SATISFIED",
    "USER_MANUAL": "SATISFIED",
    "ARCHITECTURE_GUIDE": "SATISFIED",
    "DEVELOPER_GUIDE": "SATISFIED",
    "AUDIT_GUIDE": "SATISFIED",
    "OPERATIONS_GUIDE": "SATISFIED"
  },
  "machine_readable_surfaces": {
    "QUESTION_CONTRACT": "SATISFIED",
    "TRANSITION_RECEIPT": "SATISFIED",
    "STABILITY_RECEIPT": "SATISFIED",
    "COMPLETENESS_RECEIPT": "SATISFIED",
    "PROMOTION_RECEIPT": "DEFERRED_TO_R7_L"
  },
  "remaining_sections": [
    "R7-L",
    "R7-M",
    "R7-N"
  ],
  "promotion_blockers": [
    "PROMOTION_RECEIPT_PENDING_R7_L",
    "FRESH_READER_PENDING_R7_M",
    "AGGREGATE_CLOSURE_PENDING_R7_N",
    "EXPLICIT_HUMAN_GATE_AUTHORIZATION_REQUIRED"
  ],
  "authority_state": "NONE",
  "human_gate_state": "ACTIVE",
  "promotion_state": "CANDIDATE",
  "promotion_ready": false,
  "canonical": false,
  "disposition": "COMPLETENESS_VALIDATED",
  "provenance": [
    "contracts/promotion/RING7_DOCUMENTATION_PROMOTION_BOUNDARY_REGISTRY.md",
    "receipts/promotion/R7_J_STABILITY_RECEIPT.json",
    "README.md",
    "docs/USER_MANUAL.md",
    "docs/ARCHITECTURE_GUIDE.md",
    "docs/DEVELOPER_GUIDE.md",
    "docs/AUDIT_GUIDE.md",
    "docs/OPERATIONS_GUIDE.md",
    "contracts/question/QUESTION_CONTRACT.md",
    "receipts/promotion/R7_I_TRANSITION_RECEIPT.json"
  ]
}
